asin,reviewText,overall,category,summary
B009MA34NY,"I am a recess aide and on my feet all day long. I tried these shoes on in the store before purchasing them on Amazon. They are very lightweight and comfortable. I was surprised how great they felt. I haven't had a pair of Nikes since Nike shoxs came out. They are so much more lightweight than those. I wore them an entire day the first day and had no problems. The second day; however, I got a pain in my hip to the point where I started limping. As soon as I got home and took them off, the pain was gone the rest of the evening. I'm only 30 by the way. Nothing else in my daily routine changed except wearing these shoes two days in a row. I don't understand why it would make my hip hurt since they are comfortable on my feet, but I'm sure that was the problem. I wore different shoes today and had no pain. I don't think as much as I am on my feet I will be able to wear them an extended amount of time. I will have to rotate wearing them every other day. For normal wear, I believe, people will be fine. I am literally walking or standing six hours a day straight.

**UPDATE: So, initially after wearing them, I had hip pain after wearing them. I don't know if they just needed to be broken in, but I wear them all the time now and have not experienced any pain since the first couple times of wearing them. They are comfortable, and I love them even more now.",4.0,AMAZON_FASHION_5,Comfortable and lightweight
B009MA34NY,Perfict fit for me. Great looking shoes at a great price.,5.0,AMAZON_FASHION_5,nice
B009MA34NY,The sneakers are very comfortable and fit to size.,5.0,AMAZON_FASHION_5,Five Stars
B009MA34NY,"I've had these shoes for about a week now and have so far enjoyed using them. Considering the fact that I have wide feet, the shoes are slightly tight. However, it doesn't feel uncomfortable nor does it bothers me as I use them throughout my workouts. I know some people personally like when the shoes are a bit tighter or a bit looser so it's all in personal preference.",5.0,AMAZON_FASHION_5,Wide Feet so Somewhat Tight
B009MA34NY,I really like them!,4.0,AMAZON_FASHION_5,Four Stars
B009MA34NY,Good light weight shoe...had to add insole for more support.,4.0,AMAZON_FASHION_5,Four Stars
B009MA34NY,I love my tennis shoes,5.0,AMAZON_FASHION_5,Five Stars
B009MA34NY,"This is a shoe I will wear with black dress pants or jeans when I need comfort and a little style, but I am not impressed.  This is a very flimsy shoe with little support at all.  Not like any Nike I've ever purchased in the past.  It looks nice, but it's not comfortable.",3.0,AMAZON_FASHION_5,"LOOKS GOOD, FEELS ICKY!"
B009MA34NY,"Love it!! Super comfortable and nice!! Got more than I expected, super flexible great for training. Definetly recommend it.",5.0,AMAZON_FASHION_5,Love it!! Definetly recommend it
B009MA34NY,Excelente,5.0,AMAZON_FASHION_5,Five Stars
B009MA34NY,"These shoes are poorly constructed and I don't expect them to last more that one summer.  Would not recommend, and will not order another Nike downshifter series again",2.0,AMAZON_FASHION_5,Cheap
B009MA34NY,"For the price I spent on the pair of shoes, I'd say it's as good as expected.
It's comfortable and doesn't hurt my feet when I run.",4.0,AMAZON_FASHION_5,Pretty comfortable pair of running shoes
B0092UF54A,"For the price I spent on the pair of shoes, I'd say it's as good as expected.
It's comfortable and doesn't hurt my feet when I run.",4.0,AMAZON_FASHION_5,Pretty comfortable pair of running shoes
B0092UF54A,I always get a half size up in my tennis shoes. For some reason these feel to big in the heel area and wide.,3.0,AMAZON_FASHION_5,I always get a half size up in my tennis ...
B0092UF54A,Put them on and walked 3 hours with no problem! Love them! So light feeling,5.0,AMAZON_FASHION_5,Love them! So light feeling
B0092UF54A,excelente,5.0,AMAZON_FASHION_5,Five Stars
B0092UF54A,"The shoes fit well in the arch area. They are a little wider in the toe area of the shoe, you feel like you have a lot of room. This does not make the shoe uncomfortable, just had to get used to it. Love the shoe.",4.0,AMAZON_FASHION_5,you feel like you have a lot of room
B0092UF54A,"Tried them on in a store before buying online so I knew they'd fit good. Overall I was looking for a durable cross training shoe that would hold up to my rigorous training and these have been great so far. They are really light and comfortable. Most importantly for me they have grips on the bottoms so my feet don't slide out from under me while doing planks, push-ups, etc. Highly satisfied with this purchase.",5.0,AMAZON_FASHION_5,Exactly What I Was Looking For
B0092UF54A,I recommend that!,5.0,AMAZON_FASHION_5,Five Stars
B0092UF54A,"My son likes these, and this is the 2nd pair he's worn.",5.0,AMAZON_FASHION_5,"Good shoes, tolerable price."
B0092UF54A,"Super comfortable and fit my small feet perfectly. I have flat feet so a lot of shoes are not comfortable for long periods of time. I can wear the shoe all day long and they are super comfortable. They are light colored so any dirt will be seen right away, but they are easy to clean compared to other shoes Ive had. Would definitely buy another pair in a different color.",5.0,AMAZON_FASHION_5,LOVE my new sneakers!
B0092UF54A,Love these shoes!,5.0,AMAZON_FASHION_5,Very confortable!
B0092UF54A,Comfortable,5.0,AMAZON_FASHION_5,Five Stars
B0092UF54A,Fit fine...did not like color in person,3.0,AMAZON_FASHION_5,Three Stars
B0092UF54A,The shoe is too large. When you do lunges it hurts the heel. The shoe size from a local store is the size I ordered from Amazon however the size or fitting seems to be large,3.0,AMAZON_FASHION_5,somewhat large fit
B0092UF54A,Really great for walking I'm very glad I got these and the color is fun,5.0,AMAZON_FASHION_5,Five Stars
B0092UF54A,Love these shoes. My feet feel so much better. Lots of padding and light enough to run in.,5.0,AMAZON_FASHION_5,Five Stars
B0092UF54A,ok but too big,3.0,AMAZON_FASHION_5,Three Stars
B0092UF54A,Love these shoes.. they are so comfortable.,5.0,AMAZON_FASHION_5,Five Stars
B0092UF54A,"In really like these. I wear between a 9-9.5 womens, I got the 9.5 and they fit perfectly. They are light weight but have good support. I will buy another pair.",5.0,AMAZON_FASHION_5,Great Shoe
B0092UF54A,"Love these shoes!
So stylish and comfortable. Just got back from a trip to NYC, Black and white Nikes and yoga pants are in high fashion right now!",5.0,AMAZON_FASHION_5,Love these shoes
B0092UF54A,"This shoe is JUST OK. Its not as comfortable as I was expecting, compared to my last pair of NIKE shoes. I hope they hold up.",3.0,AMAZON_FASHION_5,Its not as comfortable as I was expecting
B0092UF54A,Best tennis shoes I've had all my life. Very comfortable out the box. I would buy 10 pairs of these shoes if had the money.,5.0,AMAZON_FASHION_5,Very Comfortable
B0092UF54A,The color pattern and fit is what I liked the most what I liked the least is that they are not easy to clean and stains do not come out very easy or at all,5.0,AMAZON_FASHION_5,The color pattern and fit is what I liked the most what I liked the least is that ...
B0092UF54A,"love these shoes. Workout in them 3-4 times a week at the gym. I do treadmill, stairmaster, cardio classes and weight lifting. lightweight and versatile shoe.",5.0,AMAZON_FASHION_5,Great shoe for the price!
B0092UF54A,"Great shoe. I've had Nike's before and have always been pleased with the comfort, performance, and quality. Though I will say this was the first time I ordered a pair online without trying them on first, so I was nervous. But this turned out to be a great choice. Breathable, lightweight but sturdy, and comfortable during all my workouts. The built-in arch support is great and I've had no discomfort after 2 weeks of use. As far as the sole thickness and cushioning goes, I would consider these a 'medium' build (not thin, not overly thick) so if you're into heavy running outdoors then take that into consideration. Everyone is different in their preference for cushioning, but I think for light runs on a treadmill they would be sufficient. Love these, highly recommend!",5.0,AMAZON_FASHION_5,Great shoe!
B0092UF54A,The material is real then hope they don't fall apart . to expensive for what you get.,3.0,AMAZON_FASHION_5,Three Stars
B0092UF54A,Nice,3.0,AMAZON_FASHION_5,Three Stars
B0092UF54A,Gracias,5.0,AMAZON_FASHION_5,Five Stars
B0092UF54A,Love these shoes!! They are true to size and very comfortable!! This is my second pair - I wore out the first pair!! Good arch support - I have a high arch!!,5.0,AMAZON_FASHION_5,Love these shoes
B0092UF54A,Great arch support and comfortable.,5.0,AMAZON_FASHION_5,Great cross trainer
B0092UF54A,It looks a bit nicer on the picture. Its very light in such a way that when I held the box I wondered if there was just paper filling inside. They are comfortable for the most. Good looking training shoes overall.,4.0,AMAZON_FASHION_5,They are comfortable for the most but just a bit narrow
B0092UF54A,second pair. Comfortable and great for people with bunion issues or previous surgeries.  Sole wears great,5.0,AMAZON_FASHION_5,staple sneakers
B0092UF54A,My daughter loves these shoes. Fit true to size.,5.0,AMAZON_FASHION_5,Great looking shoe
B0092UF54A,Purchased for my daughter for gym class.  She loves them.  Very cute and very comfortable.,5.0,AMAZON_FASHION_5,Great shoes.
B0092UF54A,Great look but zero support inside the shoe. Had to buy expensive inserts to be wearable. Expected more from a nike shoe.,3.0,AMAZON_FASHION_5,"Style 10/10, Comfort 3/10"
B0092UF54A,"Straight out of the box, these shoes are great! Very lightweight and fits comfortably on my feet like a glove! I love most especially that the sole is not bulky like my previous running shoes  I hated those things lol! I would give them a shot and they are great for the price!",5.0,AMAZON_FASHION_5,these shoes are great! Very lightweight and fits comfortably on my feet ...
B0092UF54A,Great shoes. Fit perfectly. Comfortable right from the start. Light weight and perfect for a 12 hour work shift. Good price also.,5.0,AMAZON_FASHION_5,Great shoes. Fit perfectly
B0092UF54A,I love them! They fit perfect and are very comfortable!!,5.0,AMAZON_FASHION_5,Five Stars
B0092UF54A,Love these lightweight shoes! Absolute favorite. Always order half a size bigger with nike shoes than with every other shoe in my closet.,5.0,AMAZON_FASHION_5,Perfect. Lightweight and comfortable all day
B0092UF54A,My knees were bothering me during HIIT workouts so i  purchased these shoes after researching many styles.  Fit true to size and are lightweight.  My knees feel better so so hard so good.  They are cute in too!!,5.0,AMAZON_FASHION_5,My knees feel better so so hard so good
B0092UF54A,Love the color!,5.0,AMAZON_FASHION_5,Five Stars
B0092UF54A,"Comfortable athletic shoe,  good for the gym (ellipical, tredmill, etc.) Fit is good, and shoe is really lightweight and comfy.",4.0,AMAZON_FASHION_5,"Comfortable, lightweight Xtrainer"
B0092UF54A,"The shoes fit perfectly and came within the time frame i was given.  Very comfortable, which is needed since my job requires a lot if standing abd walking throughout the day.",5.0,AMAZON_FASHION_5,Great shoe!
B0092UF54A,They looked very cheap,1.0,AMAZON_FASHION_5,Returned...looked cheap
B0092UF54A,The fit is as expected,5.0,AMAZON_FASHION_5,Fits to size
B0092UF54A,Very comfortable shoes. This is my second pair of this style of shoe because I loved them that much.,5.0,AMAZON_FASHION_5,Very comfortable shoes. This is my second pair of this ...
B0092UF54A,"Comfortable, consistent each time I order and good looking",5.0,AMAZON_FASHION_5,Sleek and sporty
B0092UF54A,I love the shoe and it fit as expected the photos and description are accurate if you're looking for a shoe that has more cushion or support try a different style but as far as wanting a lightweight and breathable shoe this is it. I am very satisfied with this purchase,5.0,AMAZON_FASHION_5,I love the shoes and the description and photos were accurate
B0092UF54A,These are so cute and comfortable and very light. I just received them today and the fit is perfect. I normally wear an 8 1/2 and they are true to size!,5.0,AMAZON_FASHION_5,Great fit!
B0092UF54A,I always order a 1/2 size up in workout shoes.,5.0,AMAZON_FASHION_5,Lightweight
B0092UF54A,"I wore these shoe one time, from the airport in Omaha, NE to the airport in Phoenix, AZ. When I arrived in Phoenix, the left shoe/sole started squeaking and won't stop. I want to return for a refund. Need instructions for returning as no paperwork was in my package when it arrived.",1.0,AMAZON_FASHION_5,Squeaky soles
B0092UF54A,They run big and are super uncomfortable and the soles squeak. They don't breathe at all.,2.0,AMAZON_FASHION_5,Two Stars
B0092UF54A,Exactly what I expected! Comfortable and chic,5.0,AMAZON_FASHION_5,Comfortable and
B0092UF54A,They were a gift  to my daughter she loved them,5.0,AMAZON_FASHION_5,Their Cute and Pink
B0092UF54A,Love these comfy shoes. they fit like a glove.,5.0,AMAZON_FASHION_5,Five Stars
B0092UF54A,Very confortable.,5.0,AMAZON_FASHION_5,Smooth and confortable.
B0092UF54A,i love these shoes.,5.0,AMAZON_FASHION_5,Five Stars
B0092UF54A,"Lightweight, decent arch support and comfortably to wear all day doing regular activity and sprinting.",5.0,AMAZON_FASHION_5,decent arch support and comfortably to wear all day doing regular activity and sprinting
B0092UF54A,daughter loves them,5.0,AMAZON_FASHION_5,Five Stars
B0092UF54A,"I ordered a 1/2 size smaller than my usual size, and they are perfect. These shoes are hard to find. Great customer service as well.",5.0,AMAZON_FASHION_5,Good shoes
B0092UF54A,"Very good overall.
Now Ive been a huge Sketchers Go Walk fan for some time and the only reason I tried these instead of the latest number 4 of those is because the tread looked too slippery to me.
These shoes are very sturdy and the grip of the soles has been very solid so far. I use them for basic workout cardio and cross training, as well as work as a massage therapist (I go through shoes fast enough that Ive recently consolidated).
If you're a Go Walk fan, these do not offer the same level of cushion-comfort as those, HOWEVER, they offer the kind of long-term comfort to make them a durable option.
The material of the shoes seem very durable and the breathable. My feet do not feel hot in them.
Now these shoes are ideal for a basic workout or cross training, I would not get them to do 25,000 steps in Walt Disney World.
Solid choice, overall.",4.0,AMAZON_FASHION_5,Good shoes
B0092UF54A,Wife loves them!,5.0,AMAZON_FASHION_5,Five Stars
B0092UF54A,"These shoes are extremely comfortable, and fit as expected.  Will purchase again.",5.0,AMAZON_FASHION_5,Five Stars
B0092UF54A,Artculo equivocado en color,1.0,AMAZON_FASHION_5,One Star
B0092UF54A,"On the left shoe, there were two stained yellow spots.",3.0,AMAZON_FASHION_5,Not in perfect condition
B0092UF54A,"I love these, I had the previous iteration (or maybe two earlier?) and finally wore them out after several years. They are definitely a light-weight training shoe so I wouldn't get them if you are going to be doing a lot of running. But this also makes them extremely comfortable, I hadn't realized how hot running shoes made my feet until I switched to these. Good support and my feet stay cool all day, also noticeably light but well-made and long lasting.

I have worn them hiking in a pinch but don't really recommend it because the material is mesh-like and will let a lot of dirt in. But if you mainly take cardio classes and/or do weight training or just need something to wear around town look no further.",5.0,AMAZON_FASHION_5,"Very comfortable, cute, and long-lasting"
B0092UF54A,"Super light-weight, decent arch support (mine is higher than average).  I was pleasantly surprised by the sole/tread on these for my circuit training classes, as I couldn't really tell by online pics.  Also pleasantly surprised that these ran ever so slightly bigger than Nike running shoes I use to wear 15+years ago - I always wore one to 1.5 sizes larger in their ""Hurache's""/running shoes, so I was really worried my size 6 would be too small - there is actually more toe room in these shoes than any other size 6 shoe I own (athletic, heel, boot).  But it is the correct amount of room from big toe to edge of shoe for me (an inch or less, I don't want my big toe being jammed into edge of shoe when lunging, jumping, etc.).  Shoes arrived with an odd yellowish color on side of one shoe, but no damage to box, paper lining etc - I was happy that a clorox wipe easily cleaned the shoe and did not discolor any further.  I am very happy and highly recommend, although I have only worked out it once!",5.0,AMAZON_FASHION_5,"Super light-weight, nice tread and arch support - love them so far!"
B0092UF54A,I Love it. It is very light and the color is great.,5.0,AMAZON_FASHION_5,Five Stars
B0092UF54A,"My wife loves these shoes. We have both been wearing sketchers and new balance for several years and recently we have both purchased Nike. There is a reason why Nike is still number 1 after all these years, you just cant beat their comfort.",5.0,AMAZON_FASHION_5,My wife loves these shoes. We have both been ...
B0092UF54A,"Absolutly love these shoes!! Beautiful color, comfy, and lightweight",5.0,AMAZON_FASHION_5,New Favorite Shoes
B0092UF54A,"I **loved** these shoes when I got them. I've noticed that the foam inside tends to compress during a workout, though. I'll lace them tightly enough that they're nearly cutting off my circulation. 20 minutes later, I'm sliding out of them while doing sled pushes.",2.0,AMAZON_FASHION_5,Foam compresses
B0092UF54A,She loves them,5.0,AMAZON_FASHION_5,Five Stars
B0092UF54A,"These are a bit longer than they should be. I usually wear a 9 but could have easily ordered a 8.5. The width is accurate.

The pink is even pinker than shown and the light gray is over the very bright pink so it isn't as gray as shown in the picture. It makes the shoe a bit overwhelming. Also two grommets on each shoe is dark. I'm not referring to the dark grommets closer to the toe as shown in the photo, I'm talking about two grommets up at the top of of the laces (opposite side of side shown in photo). I thought it was faulty at first until I noticed they were on the same side of each shoe. Kind of odd and not pictured.

Overall, they are very comfortable shoes which is why I am keeping them...even if you can see me coming from a mile away.",3.0,AMAZON_FASHION_5,I usually wear a 9 but could have easily ordered a 8
B0092UF54A,great,5.0,AMAZON_FASHION_5,Five Stars
B0092UF54A,c,5.0,AMAZON_FASHION_5,Five Stars
B0092UF54A,Love them!,5.0,AMAZON_FASHION_5,Five Stars
B0092UF54A,"Very nice shoe, just a bit to snug/small for my foot. The Flex wire really makes it the shoe fit tight to your foot. I need more ""wiggle"" room in my footwear, otherwise I would have kept them.",3.0,AMAZON_FASHION_5,Fits snug
B0092UF54A,"Not sure why, but my mid section of my foot starts to hurt using these shoes for a long day or a tough workout at the gym. I've owned other nike shoes of this line but that never happened to me.",3.0,AMAZON_FASHION_5,"Not sure why, but my mid section of my ..."
B0092UF54A,My New Gym shoes! Love them,4.0,AMAZON_FASHION_5,Love
B0092UF54A,Perfect!,5.0,AMAZON_FASHION_5,Five Stars
B0092UF54A,I usually wear a size 8 and they fit fine. These are way too narrow. Thought they might stretch out but they didnt. Had to give away.,1.0,AMAZON_FASHION_5,TOO NARROW!
B0092UF54A,"Great shoe! Outside arch is kind of high, but I'm still breaking them in. So I'm sure that will work it's way out. I originally ordered a 9, my regular size, and it was a tad too big. Returned and ordered an 8.5 and it fits perfect!",5.0,AMAZON_FASHION_5,Consider sizing down 1 size
B0092UF54A,I had to return the first pair and buy a 1/2 size smaller.  First time I've had to buy smaller for Nike.,4.0,AMAZON_FASHION_5,Seem to Run Big
B0092UF54A,Fit comfortable,5.0,AMAZON_FASHION_5,Five Stars
B0092UF54A,"My favorite running shoes!  The wall of the shoe is very thin, which makes them very comfortable to wear if your feet swell as you run.  I would not recommend for use on concrete or a treadmill, as there isn't very much impact absorption, but they are perfect for trail running!",5.0,AMAZON_FASHION_5,Perfect for trails
B0092UF54A,Nice fit,4.0,AMAZON_FASHION_5,Four Stars
B0092UF54A,"I bought these for gym training - weight class and dance class (body jam, Zumba) - and really wanted to like them, since I loved the color and the light weight feel. But when I worked out high impact, my toes tingled, went numb and cramped because the toe bed is very narrow. Also, there wasn't enough cushion for me. When doing lunges, the ball of my feet hurt. Can't return them because I wore them several times. These might be fine for someone with a narrow foot.",2.0,AMAZON_FASHION_5,"Zumba) - and really wanted to like them, since I loved the color and the ..."
B0092UF54A,"They fit perfect, extremely comfortable",5.0,AMAZON_FASHION_5,Five Stars
B0092UF54A,No arch support but l love the colors!,3.0,AMAZON_FASHION_5,Three Stars
B0092UF54A,Shoe was somewhat large,4.0,AMAZON_FASHION_5,Size problem
B0092UF54A,love them!,5.0,AMAZON_FASHION_5,Five Stars
B0092UF54A,"This is a great shoe for in gym workouts. I did take a 10 mile hike and had a blister on my pinky, but other than that these are very comfortable shoes!",4.0,AMAZON_FASHION_5,"True to size, would recommend"
B0092UF54A,Comfortable and light,5.0,AMAZON_FASHION_5,Best birthday present
B0092UF54A,Purchased these for my wife as she has a similar pair that is wearing out.  She has feet are difficult to fit and these fit perfectly without pressure on sensitive portions of her feet.,5.0,AMAZON_FASHION_5,Purchased these for my wife as she has a similar ...
B0092UF54A,"I have pretty high arches and my calves always hurt at the gym with other shoes. I have been on the hunt for a good cross trainer that I can use to lift, take gym classes, and lightly jog/run on the treadmill. These have been wonderful! I don't ever have any pain in my calves or my feet when wearing these and they fit like a glove. Highly recommend!",5.0,AMAZON_FASHION_5,I have pretty high arches and my calves always hurt at the ...
B0092UF54A,Great shoes,5.0,AMAZON_FASHION_5,Five Stars
B0092UF54A,These were exactly what I expected.,5.0,AMAZON_FASHION_5,Five Stars
B0092UF54A,Love love love,5.0,AMAZON_FASHION_5,Five Stars
B0092UF54A,I always wear a womans 9 in Nikes but these are bigger than usual. The right one almost slips off my foot a bit.  They are really light and not as sturdy as what I was looking for but over all not bad.,3.0,AMAZON_FASHION_5,They are really light and not as sturdy as what I was looking for but over all ...
B0092UF54A,These shoes are awesome!!,5.0,AMAZON_FASHION_5,Five Stars
B0092UF54A,"l always buy Nike shoes and been happy so far, but this time my left shoe fit perfectly while the right shoe was too loose on my heal and when I tighten it more it was hurting side of my foot.",3.0,AMAZON_FASHION_5,l always buy Nike shoes and been happy so far
B0092UF54A,Bought these as my back up shoes but they have turned into my daily ones I go to! So comfortable and my feet don't hurt after long hours on my feet. I own a cleaning business so I need my feet not to hurt in the middle of the day.,5.0,AMAZON_FASHION_5,Honestly Fantastic Shoes
B0092UF54A,Absolutely love these shoes and color!! They are perfect for running! I run roughly 4 miles 3x per week. This is my second or 3rd pair of this exact style. Fit is perfect!,5.0,AMAZON_FASHION_5,Absolutely love these shoes and color
B0092UF54A,Super comfy!,5.0,AMAZON_FASHION_5,Five Stars
B0092UF54A,Ordered half a size larger than my usual shoe size and fits perfectly.,5.0,AMAZON_FASHION_5,Nike runs small
B0092UF54A,Fit well.,5.0,AMAZON_FASHION_5,Five Stars
B0092UF54A,The fit was perfect! I Highly recommend this shoe.,5.0,AMAZON_FASHION_5,Five Stars
B0092UF54A,"Obsessed with these shoes! I was looking for good all around sneakers (running, walking, tennis, etc.) and these more than fit the bill. I was looking specifically for black nikes (I love the fit) with white soles (good for court sports); I was a little reluctant to purchase because I wasn't sure whether the black on the soles would contact the ground, but it doesn't!",5.0,AMAZON_FASHION_5,Very Happy Customer
B0092UF54A,"Cute shoe, fit as expected, and very comfortable.",5.0,AMAZON_FASHION_5,and very comfortable.
B0092UF54A,"On time, nice sneakers. Fit as expected.",5.0,AMAZON_FASHION_5,nice sneakers. Fit as expected
B0092UF54A,"Perfect fit, as always.",5.0,AMAZON_FASHION_5,5 stars
B0092UF54A,"Great shoe, very comfortable",5.0,AMAZON_FASHION_5,Five Stars
B0092UF54A,Love these sneakers! Perfect fit and super light,5.0,AMAZON_FASHION_5,Five Stars
B0092UF54A,These shoes fit like a glove! Light but very supportive! I have worn them several times and feel very light on my feet.,5.0,AMAZON_FASHION_5,These shoes fit like a glove
B0092UF54A,Fit true to size,5.0,AMAZON_FASHION_5,Five Stars
B0092UF54A,Love the fit,5.0,AMAZON_FASHION_5,Five Stars
B0092UF54A,Nike always makes a good shoe ..abit rough breaking them in but after 9 hours on my feet anyone's feet would hurt abit,4.0,AMAZON_FASHION_5,Nike always makes a good shoe.
B0092UF54A,Oops! I returned these because I ordered wrong size!,1.0,AMAZON_FASHION_5,One Star
B0092UF54A,Extremely comfortable sneaker!,5.0,AMAZON_FASHION_5,Five Stars
B0092UF54A,Good looking shoe,5.0,AMAZON_FASHION_5, Shoes
B0092UF54A,I have had this style before in a different color and have received many compliments on the shoes.  They are great walking shoes!  I wear orthotics and these shoes are one of the best I have found to accommodate them for fit.,4.0,AMAZON_FASHION_5,Love these shoes
